{
  "$schema": "https://json-schema.org/draft/2020-12/schema",
  "$id": "https://github.com/PROFITH/saves_app/schemas/session_manifest.v1.1.schema.json",
  "title": "SAVES session manifest",
  "description": "Timing and synchronization metadata of one laboratory session. Written by the live protocol app (e.g. lab_protocol_timer) and read by SAVES for offline synchronization. All timestamps are ISO-8601 strings with an explicit UTC offset.",
  "type": "object",
  "required": [
    "schema_version",
    "session_id",
    "created_by",
    "session_start_time_utc",
    "session_end_time_utc",
    "activities",
    "sync_windows"
  ],
  "properties": {
    "schema_version": {
      "const": "1.1"
    },
    "session_id": {
      "type": "string",
      "minLength": 1
    },
    "created_by": {
      "type": "string",
      "description": "Application that wrote the manifest, ideally with its version."
    },
    "session_start_time_utc": {
      "$ref": "#/$defs/timestamp"
    },
    "session_end_time_utc": {
      "$ref": "#/$defs/timestamp"
    },
    "protocol": {
      "type": "object",
      "description": "Protocol definition used during the session (optional).",
      "properties": {
        "protocol_id": {
          "type": "string"
        },
        "protocol_version": {
          "type": "string"
        }
      }
    },
    "participants": {
      "type": "array",
      "items": {
        "type": "object",
        "required": [
          "participant_id",
          "redcap_event_name"
        ],
        "properties": {
          "participant_id": {
            "type": "string"
          },
          "redcap_event_name": {
            "type": "string"
          }
        }
      }
    },
    "activities": {
      "type": "array",
      "items": {
        "type": "object",
        "required": [
          "activity_index",
          "activity_start_time_utc",
          "activity_end_time_utc",
          "duration_seconds"
        ],
        "properties": {
          "activity_index": {
            "type": "integer",
            "minimum": 1
          },
          "activity_start_time_utc": {
            "$ref": "#/$defs/timestamp"
          },
          "activity_end_time_utc": {
            "$ref": "#/$defs/timestamp"
          },
          "duration_seconds": {
            "type": "number",
            "minimum": 0
          },
          "activity_name": {
            "type": "string"
          },
          "compendium_code": {
            "type": "string",
            "description": "Five-digit code of the Adult Compendium of Physical Activities."
          },
          "planned_duration_seconds": {
            "type": "number",
            "minimum": 0
          }
        }
      }
    },
    "sync_windows": {
      "type": "array",
      "items": {
        "type": "object",
        "required": [
          "event_id",
          "event_type",
          "activity_index",
          "phase",
          "window_start_time_utc",
          "window_end_time_utc"
        ],
        "properties": {
          "event_id": {
            "type": "string"
          },
          "event_type": {
            "type": "string"
          },
          "activity_index": {
            "type": "integer"
          },
          "phase": {
            "enum": [
              "static_prep",
              "activity_main",
              "static_post",
              "transition_lap"
            ]
          },
          "window_start_time_utc": {
            "$ref": "#/$defs/timestamp"
          },
          "window_end_time_utc": {
            "$ref": "#/$defs/timestamp"
          }
        }
      }
    },
    "video": {
      "type": "object",
      "properties": {
        "files": {
          "type": "array",
          "items": {
            "type": "string"
          }
        }
      }
    },
    "sensors": {
      "type": "object",
      "description": "Sensors used in the session, keyed by a sensor identifier.",
      "additionalProperties": {
        "type": "object",
        "required": [
          "present",
          "timestamp_domain"
        ],
        "properties": {
          "present": {
            "type": "boolean"
          },
          "timestamp_domain": {
            "enum": [
              "native_plus_host_utc",
              "device_clock_utc",
              "device_clock_local",
              "video_relative",
              "unknown"
            ]
          },
          "device_name": {
            "type": "string"
          },
          "placement": {
            "type": "string"
          },
          "connection": {
            "enum": [
              "live",
              "offline"
            ]
          },
          "type": {
            "type": "string",
            "description": "Device type: ax3, ax6, actigraph_gt3x, geneactiv, matrix, sens, senswear, polar_h10, verity_sense, camera, other."
          },
          "dominance": {
            "enum": [
              "dominant",
              "non_dominant"
            ]
          },
          "side": {
            "enum": [
              "left",
              "right"
            ]
          },
          "placement_label": {
            "type": "string"
          },
          "serial": {
            "type": "string"
          },
          "sampling_rate_hz": {
            "type": "number",
            "exclusiveMinimum": 0
          },
          "range_g": {
            "type": "number",
            "exclusiveMinimum": 0
          },
          "free_living": {
            "type": "boolean"
          },
          "signals": {
            "type": "array",
            "description": "Streams requested from a live device, e.g. acc, ecg, heart_rate, rr, ppg, ppi, gyro, mag.",
            "items": {
              "type": "string"
            }
          },
          "files": {
            "type": "array",
            "description": "Names (no folder) of the CSV files of a live device that got rows.",
            "items": {
              "type": "string"
            }
          }
        }
      }
    }
  },
  "$defs": {
    "timestamp": {
      "type": "string",
      "pattern": "^\\d{4}-\\d{2}-\\d{2}T\\d{2}:\\d{2}:\\d{2}(\\.\\d+)?(Z|[+-]\\d{2}:\\d{2})$"
    }
  }
}
